{"$schema":"https://json-schema.org/draft/2020-12/schema","$id":"https://wrs-dojo.local/schemas/wrs-substep-source-packet-v1.schema.json","title":"WRS Substep Source Packet v1","description":"Versioned curriculum-authority packet for one Substep. Persistent packets should prefer source locators/content IDs over duplicating copyrighted source text.","type":"object","additionalProperties":false,"required":["schemaVersion","packetId","substep","curriculumRelease","packetVersion","verifiedAt","authority","currentConcept","sourceOrderedTeachingSequence","cumulativeEligibility","partInputs","notebook","verification"],"properties":{"schemaVersion":{"const":"wrs-substep-source-packet-v1"},"packetId":{"type":"string","minLength":1},"substep":{"type":"string","pattern":"^[0-9]+\\.[0-9]+$"},"curriculumRelease":{"type":"string","minLength":1},"packetVersion":{"type":"string","minLength":1},"verifiedAt":{"type":"string","format":"date-time"},"authority":{"type":"array","minItems":1,"items":{"$ref":"#/$defs/sourceAuthority"}},"currentConcept":{"type":"array","minItems":1,"items":{"$ref":"#/$defs/contentRef"}},"sourceOrderedTeachingSequence":{"type":"array","items":{"$ref":"#/$defs/contentRef"}},"cumulativeEligibility":{"$ref":"#/$defs/cumulativeEligibility"},"partInputs":{"$ref":"#/$defs/partInputs"},"notebook":{"type":"array","items":{"$ref":"#/$defs/contentRef"}},"knownGaps":{"type":"array","items":{"type":"string","minLength":1}},"ocrConcerns":{"type":"array","items":{"type":"string","minLength":1}},"verification":{"$ref":"#/$defs/verification"}},"$defs":{"sourceAuthority":{"type":"object","additionalProperties":false,"required":["sourceId","kind","label","edition","locator","priority","verificationStatus"],"properties":{"sourceId":{"type":"string","minLength":1},"kind":{"enum":["step-instruction","instructor-manual","dictation-book","student-reader","student-notebook-answer-key","scope-sequence","assessment","district","derived-index"]},"label":{"type":"string","minLength":1},"edition":{"type":"string"},"locator":{"type":"string","minLength":1},"priority":{"type":"integer","minimum":1,"maximum":9},"verificationStatus":{"enum":["visual-verified","searchable-companion","conditional","blocked"]}}},"contentRef":{"type":"object","additionalProperties":false,"required":["contentId","sourceId","locator","verificationStatus"],"properties":{"contentId":{"type":"string","minLength":1},"sourceId":{"type":"string","minLength":1},"locator":{"type":"string","minLength":1},"verificationStatus":{"enum":["verified","needs-verification","blocked"]},"role":{"type":"string"},"notes":{"type":"string"}}},"cumulativeEligibility":{"type":"object","additionalProperties":false,"required":["throughSubstep","soundInventoryRefs","wordElementRefs","hfwRefs","reviewPoolRefs"],"properties":{"throughSubstep":{"type":"string","pattern":"^[0-9]+\\.[0-9]+$"},"soundInventoryRefs":{"type":"array","items":{"$ref":"#/$defs/contentRef"}},"wordElementRefs":{"type":"array","items":{"$ref":"#/$defs/contentRef"}},"hfwRefs":{"type":"array","items":{"$ref":"#/$defs/contentRef"}},"reviewPoolRefs":{"type":"array","items":{"$ref":"#/$defs/contentRef"}}}},"partInputs":{"type":"object","additionalProperties":false,"required":["1","2","3","4","5","6","7","8","9","10"],"properties":{"1":{"$ref":"#/$defs/partInput"},"2":{"$ref":"#/$defs/partInput"},"3":{"$ref":"#/$defs/partInput"},"4":{"$ref":"#/$defs/partInput"},"5":{"$ref":"#/$defs/partInput"},"6":{"$ref":"#/$defs/partInput"},"7":{"$ref":"#/$defs/partInput"},"8":{"$ref":"#/$defs/partInput"},"9":{"$ref":"#/$defs/partInput"},"10":{"$ref":"#/$defs/partInput"}}},"partInput":{"type":"object","additionalProperties":false,"required":["status","contentRefs"],"properties":{"status":{"enum":["ready","partial","blocked","tbd"]},"contentRefs":{"type":"array","items":{"$ref":"#/$defs/contentRef"}},"selectionRules":{"type":"array","items":{"type":"string","minLength":1}},"notes":{"type":"string"}}},"verification":{"type":"object","additionalProperties":false,"required":["status","verifiedBy","sourceReleaseId","blockingIssues"],"properties":{"status":{"enum":["verified","partial","blocked"]},"verifiedBy":{"type":"string","minLength":1},"sourceReleaseId":{"type":"string","minLength":1},"blockingIssues":{"type":"array","items":{"type":"string","minLength":1}}}}}}